{
  "$schema": "http://json-schema.org/draft-07/schema#",
  "$id": "https://powermatch/ability.schema.json",
  "title": "Ability",
  "type": "object",
  "required": ["id", "name", "tags", "createdAt", "updatedAt"],
  "properties": {
    "id":   { "type": "string", "minLength": 1 },
    "name": { "type": "string", "minLength": 1 },
    "description": { "type": ["string", "null"] },
    "lore":        { "type": ["string", "null"] },
    "iconPath":    { "type": ["string", "null"] },
    "type":        { "type": ["string", "null"] },

    "tags": {
      "type": "array",
      "items": {
        "type": "object",
        "required": ["tagId", "aspectValues"],
        "properties": {
          "tagId": { "type": "string", "minLength": 1 },
          "aspectValues": {
            "type": "object",
            "additionalProperties": true
          }
        },
        "additionalProperties": false
      }
    },

    "createdAt": { "type": "string", "format": "date-time" },
    "updatedAt": { "type": "string", "format": "date-time" }
  },
  "additionalProperties": true
}