{
  "id": "b57a2303-db3e-5cba-8a4e-acdda9a509c7",
  "name": "Рассечение (Dismantle)",
  "description": "Метательные разрезы Сукуны. Поражают на расстоянии.",
  "type": "innate_technique",
  "tags": [
    {
      "tagId": "damage",
      "aspectValues": {
        "power": 80,
        "damageType": "energy",
        "ignoresDefense": true
      }
    },
    {
      "tagId": "ranged",
      "aspectValues": {
        "meters": 100,
        "projectileSpeed": 85
      }
    }
  ],
  "createdAt": "2025-01-01T00:00:00.000Z",
  "updatedAt": "2025-01-01T00:00:00.000Z"
}