{
  "id": "0a02e810-ba61-5952-ab9f-6940bd93c054",
  "name": "Проклятая речь",
  "description": "Техника клана Инумаки. Слова становятся приказами, которые нельзя ослушаться.",
  "type": "innate_technique",
  "tags": [
    {
      "tagId": "control",
      "aspectValues": {
        "controlType": "mind_control",
        "targets": 3,
        "durationSeconds": 30
      }
    },
    {
      "tagId": "debuff",
      "aspectValues": {
        "target": "group",
        "debuffedAxis": "spd",
        "penalty": 30,
        "durationType": "temporary"
      }
    },
    {
      "tagId": "chakra_cost",
      "aspectValues": {
        "description": "сильно нагружает горло",
        "percentOfPool": 20
      }
    }
  ],
  "createdAt": "2025-01-01T00:00:00.000Z",
  "updatedAt": "2025-01-01T00:00:00.000Z"
}